{
  "baselineRps": 10,
  "capturedAt": "2026-07-28T04:21:45.865926Z",
  "completedAt": "2026-07-28T04:21:37.161Z",
  "excludedNode": null,
  "expectedNodes": [
    "node-1",
    "node-2",
    "node-3"
  ],
  "loadEvidenceSha256": "dcac2ba1c2c376c161e823e9e16cd40a282deb10cc49c5cf8065ae7fe7021bbf",
  "profile": "steady",
  "releaseId": "src-0541078d8f68c5f05df6cf21f665e6714390d4e4",
  "requestedRps": 10,
  "runId": "src-0541078-dist-010b",
  "samples": [
    {
      "capturedAt": "2026-07-28T04:21:06.036508Z",
      "nodes": [
        {
          "containers": [
            {
              "blockIo": "0B / 16.4kB",
              "cpuPercent": "3.95%",
              "memory": "8.328MiB / 31.34GiB",
              "memoryPercent": "0.03%",
              "name": "massar_production-gateway-1",
              "networkIo": "6.54MB / 6.72MB",
              "pids": "10"
            },
            {
              "blockIo": "0B / 0B",
              "cpuPercent": "0.36%",
              "memory": "50.84MiB / 31.34GiB",
              "memoryPercent": "0.16%",
              "name": "massar_production-worker-1",
              "networkIo": "390kB / 490kB",
              "pids": "12"
            },
            {
              "blockIo": "0B / 0B",
              "cpuPercent": "0.00%",
              "memory": "45.33MiB / 31.34GiB",
              "memoryPercent": "0.14%",
              "name": "massar_production-student-1",
              "networkIo": "2.75kB / 25.6kB",
              "pids": "12"
            },
            {
              "blockIo": "0B / 0B",
              "cpuPercent": "0.00%",
              "memory": "45.11MiB / 31.34GiB",
              "memoryPercent": "0.14%",
              "name": "massar_production-teacher-1",
              "networkIo": "2.88kB / 26.9kB",
              "pids": "12"
            },
            {
              "blockIo": "0B / 0B",
              "cpuPercent": "0.01%",
              "memory": "45.56MiB / 31.34GiB",
              "memoryPercent": "0.14%",
              "name": "massar_production-staff-1",
              "networkIo": "2.79kB / 25kB",
              "pids": "12"
            },
            {
              "blockIo": "0B / 0B",
              "cpuPercent": "0.00%",
              "memory": "56.63MiB / 31.34GiB",
              "memoryPercent": "0.18%",
              "name": "massar_production-landing-1",
              "networkIo": "62.9kB / 6.22MB",
              "pids": "12"
            },
            {
              "blockIo": "0B / 0B",
              "cpuPercent": "0.00%",
              "memory": "45.23MiB / 31.34GiB",
              "memoryPercent": "0.14%",
              "name": "massar_production-admin-1",
              "networkIo": "2.64kB / 27.5kB",
              "pids": "12"
            },
            {
              "blockIo": "0B / 4.1kB",
              "cpuPercent": "0.46%",
              "memory": "188.4MiB / 31.34GiB",
              "memoryPercent": "0.59%",
              "name": "massar_production-backend-1",
              "networkIo": "325kB / 297kB",
              "pids": "41"
            },
            {
              "blockIo": "0B / 0B",
              "cpuPercent": "0.03%",
              "memory": "17.45MiB / 31.34GiB",
              "memoryPercent": "0.05%",
              "name": "massar-backup-tls-proxy",
              "networkIo": "0B / 0B",
              "pids": "9"
            },
            {
              "blockIo": "0B / 374MB",
              "cpuPercent": "0.14%",
              "memory": "13.25MiB / 31.34GiB",
              "memoryPercent": "0.04%",
              "name": "massar-backup-bucket",
              "networkIo": "0B / 0B",
              "pids": "12"
            }
          ],
          "cpu": {
            "busyPercent": 5.8,
            "count": 8,
            "iowaitPercent": 0.0,
            "loadAverage": [
              0.22412109375,
              0.47509765625,
              0.427734375
            ],
            "stealPercent": 4.47
          },
          "hostname": "massar-node-1",
          "memory": {
            "availableBytes": 30909140992,
            "swapFreeBytes": 0,
            "swapTotalBytes": 0,
            "totalBytes": 33648492544
          },
          "nodeId": "node-1",
          "patroni": {
            "replication": [
              {
                "application_name": "node-3",
                "client_addr": "10.77.0.13",
                "state": "streaming",
                "sync_priority": 1,
                "sync_state": "quorum",
                "usename": "replicator"
              },
              {
                "application_name": "node-2",
                "client_addr": "10.77.0.12",
                "state": "streaming",
                "sync_priority": 1,
                "sync_state": "quorum",
                "usename": "replicator"
              }
            ],
            "role": "primary",
            "state": "running",
            "timeline": 6
          },
          "postgres": {
            "activeConnections": 1,
            "connections": 20,
            "databaseBytes": 19823639,
            "maxConnections": 300,
            "replicationLagBytes": 0,
            "waitingLocks": 0,
            "walBytes": 3909294568
          },
          "queues": {
            "ai-essay-grading": {
              "active": 0,
              "delayed": 0,
              "failed": 0,
              "stalled": 0,
              "waiting": 0
            },
            "ai-live-support-turns": {
              "active": 0,
              "delayed": 0,
              "failed": 0,
              "stalled": 0,
              "waiting": 0
            },
            "ai-video-chapters": {
              "active": 0,
              "delayed": 0,
              "failed": 0,
              "stalled": 0,
              "waiting": 0
            },
            "generate-chapter-mindmaps": {
              "active": 0,
              "delayed": 0,
              "failed": 0,
              "stalled": 0,
              "waiting": 0
            },
            "notifications": {
              "active": 0,
              "delayed": 0,
              "failed": 0,
              "stalled": 0,
              "waiting": 0
            }
          },
          "redis": {
            "aof_delayed_fsync": "0",
            "blocked_clients": "18",
            "connected_clients": "79",
            "connected_slaves": "2",
            "instantaneous_ops_per_sec": "34",
            "loading": "0",
            "master_repl_offset": "40510315",
            "maxmemory": "4294967296",
            "role": "master",
            "total_commands_processed": "1686854",
            "used_memory": "3412376"
          },
          "releases": [
            {
              "name": "massar_production-gateway-1",
              "nodeId": "node-1",
              "releaseId": "src-0541078d8f68c5f05df6cf21f665e6714390d4e4",
              "status": "Up 4 minutes (healthy)"
            },
            {
              "name": "massar_production-worker-1",
              "nodeId": "node-1",
              "releaseId": "src-0541078d8f68c5f05df6cf21f665e6714390d4e4",
              "status": "Up 4 minutes (healthy)"
            },
            {
              "name": "massar_production-student-1",
              "nodeId": "node-1",
              "releaseId": "src-0541078d8f68c5f05df6cf21f665e6714390d4e4",
              "status": "Up 4 minutes (healthy)"
            },
            {
              "name": "massar_production-teacher-1",
              "nodeId": "node-1",
              "releaseId": "src-0541078d8f68c5f05df6cf21f665e6714390d4e4",
              "status": "Up 4 minutes (healthy)"
            },
            {
              "name": "massar_production-staff-1",
              "nodeId": "node-1",
              "releaseId": "src-0541078d8f68c5f05df6cf21f665e6714390d4e4",
              "status": "Up 4 minutes (healthy)"
            },
            {
              "name": "massar_production-landing-1",
              "nodeId": "node-1",
              "releaseId": "src-0541078d8f68c5f05df6cf21f665e6714390d4e4",
              "status": "Up 4 minutes (healthy)"
            },
            {
              "name": "massar_production-admin-1",
              "nodeId": "node-1",
              "releaseId": "src-0541078d8f68c5f05df6cf21f665e6714390d4e4",
              "status": "Up 4 minutes (healthy)"
            },
            {
              "name": "massar_production-backend-1",
              "nodeId": "node-1",
              "releaseId": "src-0541078d8f68c5f05df6cf21f665e6714390d4e4",
              "status": "Up 4 minutes (healthy)"
            }
          ],
          "rootDisk": {
            "freeBytes": 393056665600,
            "totalBytes": 415381426176
          }
        },
        {
          "containers": [
            {
              "blockIo": "0B / 16.4kB",
              "cpuPercent": "0.02%",
              "memory": "8.613MiB / 31.34GiB",
              "memoryPercent": "0.03%",
              "name": "massar_production-gateway-1",
              "networkIo": "6.68MB / 6.87MB",
              "pids": "10"
            },
            {
              "blockIo": "0B / 0B",
              "cpuPercent": "6.60%",
              "memory": "51.6MiB / 31.34GiB",
              "memoryPercent": "0.16%",
              "name": "massar_production-worker-1",
              "networkIo": "441kB / 572kB",
              "pids": "14"
            },
            {
              "blockIo": "0B / 0B",
              "cpuPercent": "0.01%",
              "memory": "45.52MiB / 31.34GiB",
              "memoryPercent": "0.14%",
              "name": "massar_production-admin-1",
              "networkIo": "2.71kB / 27.5kB",
              "pids": "12"
            },
            {
              "blockIo": "0B / 0B",
              "cpuPercent": "0.00%",
              "memory": "46.05MiB / 31.34GiB",
              "memoryPercent": "0.14%",
              "name": "massar_production-teacher-1",